community,tf_idf_term1,tf_idf_term2,tf_idf_term3,discipline,n_discipline,share_discipline,author_most_used,title_most_used_ref,bib_most_used_ref,title_most_cited_UBI,bib_most_cited_UBI,title_most_cited_global,bib_most_cited_global,id_most_used_ref,n_most_used_ref,share_most_used_ref,id_most_cited_UBI,n_most_cited_UBI,share_most_cited_UBI,id_most_cited_global,n_most_cited_global,share_most_cited_global
4,degrowth,south africa,poverty south africa,Economics,211,0.9173913043478261,Giorgos Kallis,"Exploring Universal Basic Income: A Guide to Navigating Concepts, Evidence, and Practices",Ugo Gentilini et al. (2019),"Exploring Universal Basic Income: A Guide to Navigating Concepts, Evidence, and Practices",Ugo Gentilini et al. (2019),An agenda for sustainability transitions research: State of the art and future directions,Jonathan Köhler et al. (2019),https://openalex.org/W2991169479,17,0.032015065913371,https://openalex.org/W2991169479,50,0.1026694045174538,https://openalex.org/W2910922638,1414,0.12877959927140256
4,social,social policy,reform south africa,Political science,145,0.6304347826086957,Joan Martínez-Alier,Crisis or opportunity? Economic degrowth for social equity and ecological sustainability. Introduction to this special issue,François Schneider et al. (2010),In defence of degrowth,Giorgos Kallis (2011),Labor Market Rigidities: At the Root of Unemployment in Europe,Horst Siebert (1997),https://openalex.org/W2023723950,14,0.026365348399246705,https://openalex.org/W2081775730,22,0.045174537987679675,https://openalex.org/W2109437806,828,0.07540983606557378
4,south,poverty south,policy germany status,Sociology,95,0.41304347826086957,Vyacheslav Bobkov,In defence of degrowth,Giorgos Kallis (2011),Crisis or opportunity? Economic degrowth for social equity and ecological sustainability. Introduction to this special issue,François Schneider et al. (2010),Is Green Growth Possible?,Jason Hickel et Giorgos Kallis (2019),https://openalex.org/W2081775730,14,0.026365348399246705,https://openalex.org/W2023723950,20,0.04106776180698152,https://openalex.org/W2937421004,777,0.07076502732240438
4,africa,full employment,germany status protection,Philosophy,59,0.2565217391304348,François Schneider,Basic Income for the European Countries: From Theory to Practice,Yuriy Kvashnin (2019),The economics of degrowth,Giorgos Kallis et al. (2012),Crisis or opportunity? Economic degrowth for social equity and ecological sustainability. Introduction to this special issue,François Schneider et al. (2010),https://openalex.org/W2979539723,8,0.015065913370998116,https://openalex.org/W2030655414,13,0.026694045174537988,https://openalex.org/W2023723950,688,0.06265938069216757
4,policy,social assistance,full employment social,Computer science,54,0.23478260869565218,Philippe Van Parijs,Basic Income as a Prologue to Social Policy of the 21st Century,,Basic Income as a Prologue to Social Policy of the 21st Century,,In defence of degrowth,Giorgos Kallis (2011),https://openalex.org/W4245952648,8,0.015065913370998116,https://openalex.org/W4245952648,9,0.018480492813141684,https://openalex.org/W2081775730,679,0.061839708561020036
4,poverty,market socialism,country theory practice,Biology,48,0.20869565217391303,Karl Widerquist,"Unconditional Basic Income: Criterial Bases, Transitional Forms and Experimental Implementation",Vyacheslav Bobkov et al. (2020),Socially Sustainable Economic De‐growth,Joan Martínez-Alier (2009),The Theory of Wages.,G. F. Shove et John Hicks (1933),https://openalex.org/W3115652188,8,0.015065913370998116,https://openalex.org/W2147393791,8,0.01642710472279261,https://openalex.org/W2798213597,653,0.05947176684881603
4,germany,social security,standard quality life,Mathematics,48,0.20869565217391303,Yelena Odintsova,The economics of degrowth,Giorgos Kallis et al. (2012),What is Degrowth? From an Activist Slogan to a Social Movement,Federico Demaria et al. (2013),What is Degrowth? From an Activist Slogan to a Social Movement,Federico Demaria et al. (2013),https://openalex.org/W2030655414,8,0.015065913370998116,https://openalex.org/W2150141679,8,0.01642710472279261,https://openalex.org/W2150141679,453,0.0412568306010929
4,market,reform south,automation different time,Business,44,0.19130434782608696,Ugo Gentilini,Russian Experts on Universal Basic Income: Estimates for 2020,Vyacheslav Bobkov et Yelena Odintsova (2021),"Unconditional Basic Income: Criterial Bases, Transitional Forms and Experimental Implementation",Vyacheslav Bobkov et al. (2020),The economics of degrowth,Giorgos Kallis et al. (2012),https://openalex.org/W3143432667,7,0.013182674199623353,https://openalex.org/W3115652188,8,0.01642710472279261,https://openalex.org/W2030655414,419,0.03816029143897996
4,employment,labor market,south solidarity grant,Engineering,39,0.16956521739130434,Margaret Grosh,Realization of the UBI Principles As An Answer to the COVID–19 Challenges,Aleksandr Zolotov et Sergey Zolotov (2020),Basic Income for the European Countries: From Theory to Practice,Yuriy Kvashnin (2019),"Rethinking Prefiguration: Alternatives, Micropolitics and Goals in Social Movements",Luke Yates (2014),https://openalex.org/W3107132921,7,0.013182674199623353,https://openalex.org/W2979539723,8,0.01642710472279261,https://openalex.org/W2047833308,363,0.03306010928961749
4,economic,labour market,good life within,Geography,26,0.11304347826086956,Iamele P. Rigolini,Basic Income,Philippe Van Parijs et Yannick Vanderborght (2017),Russian Experts on Universal Basic Income: Estimates for 2020,Vyacheslav Bobkov et Yelena Odintsova (2021),"Chronic Poverty in South Africa: Incidence, Causes and Policies",Michael Aliber (2003),https://openalex.org/W4249308963,7,0.013182674199623353,https://openalex.org/W3143432667,7,0.014373716632443531,https://openalex.org/W2008201778,269,0.024499089253187615
4,new,policy reform,social dynamic degrowth,Psychology,23,0.1,Ruslan Yemtsov,Socially Sustainable Economic De‐growth,Joan Martínez-Alier (2009),Realization of the UBI Principles As An Answer to the COVID–19 Challenges,Aleksandr Zolotov et Sergey Zolotov (2020),Socially sustainable degrowth as a social–ecological transformation: repoliticizing sustainability,Viviana Asara et al. (2015),https://openalex.org/W2147393791,7,0.013182674199623353,https://openalex.org/W3107132921,7,0.014373716632443531,https://openalex.org/W836905562,229,0.020856102003642987
4,labor,welfare state,market socialism case,History,15,0.06521739130434782,Ekaterina Chernykh,What is Degrowth? From an Activist Slogan to a Social Movement,Federico Demaria et al. (2013),A Comparative Analysis of Popular Attitudes toward the Idea of Universal Basic Income in Russia vs Europe,Anna Andreenkova (2020),Socially Sustainable Economic De‐growth,Joan Martínez-Alier (2009),https://openalex.org/W2150141679,7,0.013182674199623353,https://openalex.org/W3172435365,7,0.014373716632443531,https://openalex.org/W2147393791,186,0.016939890710382512
4,alternative,status protection,citizenship employment option,Medicine,13,0.05652173913043478,Sergey Zolotov,"The Current State of Research of the Content, Forms, Tools and Mechanisms of Introducing Unconditional Basic Income",Ekaterina Chernykh (2020),"The social, economic and fiscal impact of comprehensive social security reform for South Africa",Michael Samson (2002),Market Socialism: A Case for Rejuvenation,Pranab Bardhan et John E. Roemer (1992),https://openalex.org/W3036210657,6,0.011299435028248588,https://openalex.org/W2085484606,6,0.012320328542094456,https://openalex.org/W2151144106,183,0.016666666666666666
4,state,germany status,transition social case,Physics,12,0.05217391304347826,Valentina Pavlova,A Comparative Analysis of Popular Attitudes toward the Idea of Universal Basic Income in Russia vs Europe,Anna Andreenkova (2020),Is Green Growth Possible?,Jason Hickel et Giorgos Kallis (2019),‘New politics’ in German labour market policy? The implications of the recent Hartz reforms for the German welfare state,Achim Kemmerling et Oliver Bruttel (2006),https://openalex.org/W3172435365,6,0.011299435028248588,https://openalex.org/W2937421004,6,0.012320328542094456,https://openalex.org/W2568730543,137,0.012477231329690346
4,grant,policy germany,unemployment lesson germany,Chemistry,10,0.043478260869565216,Federico Demaria,Universal Basic Income: Reflections on the Possible Impac on Improving the Living Standards and Quality of Life and the Sustainability of Society,Vyacheslav Bobkov et al. (2019),"The Current State of Research of the Content, Forms, Tools and Mechanisms of Introducing Unconditional Basic Income",Ekaterina Chernykh (2020),"BENEFIT DURATION, UNEMPLOYMENT DURATION AND JOB MATCH QUALITY: A REGRESSION‐DISCONTINUITY APPROACH",Marco Caliendo et al. (2012),https://openalex.org/W3203785423,6,0.011299435028248588,https://openalex.org/W3036210657,6,0.012320328542094456,https://openalex.org/W1557319022,134,0.012204007285974499
